Customer,CustomerId,CustomerNo,Description,Quantity,Unit Price
RackPeople ApS,74df0893-eb0e-4e6e-a68a-c5ddf3001c1f,99999003,Microsoft Teams Rooms Pro - Microsoft Teams Rooms Pro - addQuantity  6/15/2023-6/30/2023  June   ,4.00,-476.84
RackPeople ApS,74df0893-eb0e-4e6e-a68a-c5ddf3001c1f,99999003,Power BI Premium Per User - Power BI Premium Per User - cycleCharge  6/24/2023-7/23/2023  June   ,1.00,111.76
RackPeople ApS,74df0893-eb0e-4e6e-a68a-c5ddf3001c1f,99999003,Microsoft Teams Rooms Pro - Microsoft Teams Rooms Pro - new  6/15/2023-6/30/2023  June   ,4.00,476.84
RackPeople ApS,74df0893-eb0e-4e6e-a68a-c5ddf3001c1f,99999003,Microsoft Teams Phone Standard - Microsoft Teams Phone Standard - cycleCharge  6/1/2023-6/30/2023  June   ,16.00,643.84
RackPeople ApS,74df0893-eb0e-4e6e-a68a-c5ddf3001c1f,99999003,Windows 365 Business - Windows 365 Business 2 vCPU; 4 GB; 64 GB - cycleCharge  6/10/2023-7/9/2023  June   ,1.00,166.39
RackPeople ApS,74df0893-eb0e-4e6e-a68a-c5ddf3001c1f,99999003,Microsoft Teams Rooms Pro - Microsoft Teams Rooms Pro - addQuantity  6/15/2023-6/30/2023  June   ,5.00,596.05
RackPeople ApS,74df0893-eb0e-4e6e-a68a-c5ddf3001c1f,99999003,Dynamics 365 Business Central External Accountant - Dynamics 365 Business Central External Accountant - renew  6/13/2023-7/12/2023  June   ,3.00,0.00
