Customer,CustomerId,CustomerNo,Description,Quantity,Unit Price
RackPeople ApS,74df0893-eb0e-4e6e-a68a-c5ddf3001c1f,99999003,Microsoft Copilot for Microsoft 365 - Microsoft Copilot for Microsoft 365 - addQuantity  1/22/2024-12/31/2024  January   ,2.00,-4267.60
RackPeople ApS,74df0893-eb0e-4e6e-a68a-c5ddf3001c1f,99999003,Power BI Premium Per User - Power BI Premium Per User - cycleCharge  1/24/2024-2/23/2024  January   ,1.00,111.76
RackPeople ApS,74df0893-eb0e-4e6e-a68a-c5ddf3001c1f,99999003,Microsoft Teams Phone Standard - Microsoft Teams Phone Standard - cycleCharge  1/1/2024-1/31/2024  January   ,16.00,715.52
RackPeople ApS,74df0893-eb0e-4e6e-a68a-c5ddf3001c1f,99999003,Microsoft Copilot for Microsoft 365 - Microsoft Copilot for Microsoft 365 - new  1/16/2024-12/31/2024  January   ,2.00,4341.82
RackPeople ApS,74df0893-eb0e-4e6e-a68a-c5ddf3001c1f,99999003,Windows 365 Business - Windows 365 Business 2 vCPU; 4 GB; 64 GB - cycleCharge  1/10/2024-2/9/2024  January   ,1.00,230.84
RackPeople ApS,74df0893-eb0e-4e6e-a68a-c5ddf3001c1f,99999003,Dynamics 365 Business Central External Accountant - Dynamics 365 Business Central External Accountant - renew  1/13/2024-2/12/2024  January   ,3.00,0.00
RackPeople ApS,74df0893-eb0e-4e6e-a68a-c5ddf3001c1f,99999003,Microsoft Teams Rooms Pro - Microsoft Teams Rooms Pro - cycleCharge  1/1/2024-1/31/2024  January   ,5.00,1117.60
RackPeople ApS,74df0893-eb0e-4e6e-a68a-c5ddf3001c1f,99999003,Microsoft Copilot for Microsoft 365 - Microsoft Copilot for Microsoft 365 - addQuantity  1/22/2024-12/31/2024  January   ,4.00,8535.20
